{
  "$schema": "https://raw.githubusercontent.com/filip137/nonlinear-drn-paper/main/configs/train/schema.json",
  "description": "Compact sklearn Digits training configuration for the paper's measured/PWL I-V curve.",
  "dataset": {
    "name": "digits",
    "num_samples": null,
    "train_fraction": 0.8
  },
  "layer_shapes": [[128], [32], [20]],
  "non_linearity": "experimental",
  "weight_gains": [1.0, 1.0],
  "weight_min": 1e-7,
  "weight_max": 100.0,
  "weight_init_mode": "kaiming_uniform",
  "input_gain": 10.0,
  "voltage_amp": 4.0,
  "current_amp": 1.0,
  "quadratic_diode_param": {"diode_conductance": 1.0, "v_min": -0.5, "v_max": 0.5},
  "exponential_diode_param": {"I_s": 1e-6, "V_t": 0.05, "V_off": 0.8},
  "hard_sigmoid_param": {"g_on": 10.0, "g_off": 0.1, "v_min": -1.0, "v_max": 1.0},
  "iv_data_path": "data/assets/experimental_curve_voff_0.8_200_points.npz",
  "batch_size": 32,
  "num_epochs": 15,
  "num_iterations": 32,
  "learning_rates": [0.01, 0.01, 0.01],
  "scheduler_gamma": 1.0,
  "nudging": 0.1,
  "ep_variant": "centered",
  "minimizer_impl": "custom",
  "mode": "asynchronous",
  "single_diode_updater": "custom",
  "double_diode_updater": "overrelaxed",
  "overrelaxation_factor": 1.0,
  "adaptive_equilibrium": false,
  "rel_tol": 1e-5,
  "vn_tol": 1e-6,
  "use_polish": false,
  "max_newton_iters": 32,
  "z_thresh": 1e10,
  "exp_clip": 100.0,
  "damping": 1.0,
  "experimental_newton_max_steps": 32,
  "experimental_newton_tol": 0.01,
  "seed": 0
}
